{
  "scenario": "Gordian Knot",
  "count": 60,
  "stocks": [
    {
      "id": "congressional_hearings_electrotech",
      "name": "Congressional hearings on electrotech security",
      "pmesii": "Political",
      "measures": "Count of public House/Senate committee hearings touching electrotech supply-chain security in the trailing quarter",
      "unit": "0-30 hearings/quarter (display); normalized 0-1",
      "node_value": 27,
      "inverted": false,
      "stock_type": "trust-sentiment",
      "sector": "Cross-cutting",
      "increases_when": "Crisis inject or leak surfaces compromise; Wave-2 allocation losers lobby; PRC retaliation makes headlines",
      "decreases_when": "Quarter rolls over with no salient incident; attention shifts to other crises; recess",
      "rationale": "Fast public barometer of legislative attention; spikes on the Wave-3 inject and is the most visible early signal the secret clock is going public."
    },
    {
      "id": "electrotech_legislation_enacted",
      "name": "Electrotech security laws/authorities enacted",
      "pmesii": "Political",
      "measures": "Cumulative laws or binding authorities actually enacted (appropriations, mandates, certification regimes) as opposed to merely introduced",
      "unit": "0-8 enacted (display); normalized 0-1",
      "node_value": 13,
      "inverted": false,
      "stock_type": "buildout",
      "sector": "Cross-cutting",
      "increases_when": "Bipartisan alignment converges; a major inject forces emergency passage; appropriations cycle lands",
      "decreases_when": "Sunset of temporary authorities; effectively monotonic and slow",
      "rationale": "The hard, slow output of the political system; rewards players who built coalition before the inject. Bills-introduced folded in as the leading flow into this stock."
    },
    {
      "id": "executive_orders_electrotech",
      "name": "Executive orders on electrotech supply chain",
      "pmesii": "Political",
      "measures": "Cumulative active EOs / presidential directives governing electrotech sourcing, certification, or ICTS transactions",
      "unit": "0-10 EOs (display); normalized 0-1",
      "node_value": 30,
      "inverted": false,
      "stock_type": "spendable",
      "sector": "Cross-cutting",
      "increases_when": "White House acts unilaterally when Congress stalls; inject forces emergency directive; task force recommends action",
      "decreases_when": "Revocation on administration shift; legal challenge or injunction enjoins an EO",
      "rationale": "Fast executive lever that moves in a single round under gridlock, but spends political capital, invites litigation, and risks burning the source if too overt. Absorbs the litigation-constraint draft as a durability haircut on this lever."
    },
    {
      "id": "agency_rulemakings_active",
      "name": "Federal agencies with active electrotech rulemakings",
      "pmesii": "Political",
      "measures": "Count of agencies (Commerce/BIS, DHS/CISA, Energy, DOT, FCC) with open rulemakings on electrotech sourcing or security baselines",
      "unit": "0-10 agencies (display); normalized 0-1",
      "node_value": 50,
      "inverted": false,
      "stock_type": "buildout",
      "sector": "Cross-cutting",
      "increases_when": "EO directs new rulemaking; task force assigns a sector to a lead agency; inject triggers emergency interim rules",
      "decreases_when": "Rule finalized (moves to enforcement) or withdrawn under industry pressure; litigation stay",
      "rationale": "The administrative-state workhorse and quietest lever for acting without burning the HUMINT source."
    },
    {
      "id": "interagency_alignment",
      "name": "Interagency alignment & decision velocity",
      "pmesii": "Political",
      "measures": "Coherence and decision velocity across White House/Commerce/DHS/Energy/DoD/Justice/State/IC on prioritization and messaging",
      "unit": "0-1 alignment index",
      "node_value": 47,
      "inverted": false,
      "stock_type": "trust-sentiment",
      "sector": "Cross-cutting",
      "increases_when": "Task force reaches consensus prioritization; clear lead-agency assignments; shared classified picture; principals back the task force",
      "decreases_when": "Jurisdiction/budget fights (DoD classified channel vs civilian allocation); State fears allied blowback; Justice/State raise legal/diplomatic vetoes; inject creates blame dynamics",
      "rationale": "Core enabler \u2014 high alignment unlocks EOs, DPA, rulemakings; low cohesion silently slows every player decision."
    },
    {
      "id": "presidential_political_capital",
      "name": "Executive political capital for electrotech action",
      "pmesii": "Political",
      "measures": "Discretionary political capital available to spend on contested electrotech moves before approval cost bites",
      "unit": "0-1 capital reservoir",
      "node_value": 51,
      "inverted": false,
      "stock_type": "spendable",
      "sector": "Cross-cutting",
      "increases_when": "Successful crisis management; rally effect after inject handled well; allied wins announced; early bipartisan buy-in",
      "decreases_when": "Each EO/DPA/unpopular allocation spends it; constituency backlash; visible price spikes or shortages blamed on policy",
      "rationale": "The scarce currency of executive action \u2014 spent fast and slow to refill, forcing players to sequence bold moves."
    },
    {
      "id": "congressional_bipartisan_consensus",
      "name": "Congressional bipartisan consensus",
      "pmesii": "Political",
      "measures": "Degree of cross-party agreement that electrotech compromise warrants funded action vs partisan blame framing",
      "unit": "0-1 consensus index",
      "node_value": 40,
      "inverted": false,
      "stock_type": "trust-sentiment",
      "sector": "Cross-cutting",
      "increases_when": "Shared China-threat framing; classified briefings to both caucuses; inject creates rally effect",
      "decreases_when": "Allocation losers' districts split on party lines; administration blamed for delay; election-year polarization; source leak politicized",
      "rationale": "Gates whether bills become enacted law; low value means hearings produce theater not authority. Merges majority/minority support and oversight-posture drafts into one governing consensus dial."
    },
    {
      "id": "dpa_invocations_electrotech",
      "name": "DPA invocations for electrotech",
      "pmesii": "Political",
      "measures": "Cumulative active Defense Production Act Title I/III actions directed at electrotech across all four sectors",
      "unit": "0-30 invocations (display); normalized 0-1",
      "node_value": 20,
      "inverted": false,
      "stock_type": "spendable",
      "sector": "Cross-cutting",
      "increases_when": "Task force prioritizes a sector for emergency domestic buildout; inject forces wartime-footing production; Congress appropriates Title III funds",
      "decreases_when": "Authority lapses; appropriations exhausted; industry/fiscal pushback caps further use",
      "rationale": "High-blast-radius lever bridging Political/Economic that visibly commits government to a sector but spends capital and signals alarm."
    },
    {
      "id": "industry_associations_critical",
      "name": "Industry association & coalition opposition",
      "pmesii": "Political",
      "measures": "Intensity of major coalitions (SIA, NEMA, hyperscaler groups, auto/utility associations) publicly opposing the allocation or controls",
      "unit": "0-10 associations (display); inverted, normalized 0-1",
      "node_value": 40,
      "inverted": true,
      "stock_type": "trust-sentiment",
      "sector": "Cross-cutting",
      "increases_when": "(desirable, raises stored value) Subsidies/safe-supply access buy buy-in; shared threat framing co-opts industry; classified briefings align CEOs",
      "decreases_when": "(undesirable, lowers stored value) Allocation creates clear sector losers (Wave 2); compliance/destructive-testing costs hit margins; rules imposed without consultation",
      "rationale": "Inverted lobbying-backlash gauge \u2014 the chief political cost of a contested allocation and the main Wave-2 channel through which losers fight back. Merges the public 'associations critical' and the deeper industry-cooperation reservoir."
    },
    {
      "id": "managed_unwind_credibility",
      "name": "Managed-unwind policy credibility/durability",
      "pmesii": "Political",
      "measures": "Domestic credibility and time-consistency of the multi-year managed-unwind commitment across administrations, election and budget cycles",
      "unit": "0-1 durability index",
      "node_value": 40,
      "inverted": false,
      "stock_type": "trust-sentiment",
      "sector": "Cross-cutting",
      "increases_when": "Consistent multi-round prioritization; bipartisan enacted authorities; funding actually obligated; coherent messaging",
      "decreases_when": "Whipsawed rankings; partisan reversal threats; underfunded commitments; chaotic inject response",
      "rationale": "The closing-wave win-framing stock \u2014 whether the decade-long unwind is believed durable; feeds private capital and allied confidence. Central to wrap-up scoring."
    },
    {
      "id": "prc_escalation_posture",
      "name": "PRC escalation & retaliation posture",
      "pmesii": "Military",
      "measures": "PRC's propensity to retaliate via supply withholding, accelerated compromise activation, cyber pressure, or coercion of allies in response to US moves",
      "unit": "0-100 escalation index (raw high=bad); inverted, normalized 0-1 (0=max escalation, 1=fully restrained)",
      "node_value": 70,
      "inverted": true,
      "stock_type": "scheduled-threat",
      "sector": "Cross-cutting",